ItemTitle,SKU,BarcodeNumber,Level,location
yuki love egg roll sahllot 4 bg,FD03W01186,,0,13290Daum
Baijia Instant Noodles-Chinese Spicy Fei-Chang Flavor 5-Pack,FD03W00101,6926410321228,0,13290Daum
[dis] MISS HANA MAKEUP MAGNETIC EYES PENCIL EYELINER KIT,BU22B05535,4718590212043,0,13290Daum
VITA HK Style Milk Tea 250ml,FD03W01025,061954200816,0,13290Daum
Nishiki Premium Cooked Rice 7.4oz,FD05J00536,011152107431,0,13290Daum
Dr.Morita Intensive Whitening Facial Mask,BU15M02012,4715872642079,0,13290Daum
HANAKA V-Line Chin Patch,BU22B05551,4718590213286,0,13290Daum
[dis] Miss Hana - Eyeliner (Galaxy Black) 1.3g,BU22B05530,4718590211015,0,13290Daum
Want Want Hot Kid Shelly Senbei Rice Crackers,FD04S00176,4711127202234,0,13290Daum
Klorane Gentle Dry Shampoo with Oat Milk 3.2 Oz,BU07S01441,3282770037449,0,13290Daum
Popping Candy - Super Sour,FD28S01176,4895138304375,0,13290Daum
Dr.Morita Black Pearl Essence Facial Mask,BU15M01981,4712688935876,0,13290Daum
Huang Fei Hong Spicy Cripy Peanut - 110g/3.88oz - 10 Packs,FD06E00300X10,610395735311,0,13290Daum
Crown Victory Pie-Strawberry favor,101N56513A,8801111180498,0,13290Daum
DARIYA PALTY GELEE HAIR COLOR CAFE BROWN,BU02P03375,4904651181704,0,13290Daum
Coconut Candy,FD19S01108,6917541774717,0,13290Daum
Shirakiku Dried Squid Sakiika Smoked 6oz,101N75121,074410751210,0,13290Daum
Thick Pinapple Pastry,FD19S01090,6914782208100,0,13290Daum
Fujiya Peko Poko Chocolate Lollipop,101N72182,074410721824,0,13290Daum
HAKUTSURU PLUM WINE,AL05J00045,747846030029,0,13290Daum
popping candy(lychee),FD22G01055,6921249255195,0,13290Daum
Calorie Mate-Calorie Mate Maple Balanced Food,FD02T00139,4987035032410,0,13290Daum
Kopiko Coffee Candy,101N71727,723751022373,0,13290Daum
Huang Fei Hong Spicy Cripy Peanut - 110g/3.88oz - 20 Packs,FD06E00300X20,610395735328,0,13290Daum
HANAKA CHU CHU MOISTURIZING & HYDRATING FLAVOR LIP BALM-rosebud,BU22B05561,4718590213521,0,13290Daum
YINLU Mixed Lotus seeds corn Congee 280g,FD19S00680,6926892565080,0,13290Daum
Ginbis Animal Biscuits Seaweed,FD05J00206,6922360002026,0,13290Daum
CHAOZHOULANG Fish Ball Spicy Flavor 60g,FD19S00657,6930865300202,0,13290Daum
"Glico Giant Pretz, Tomato Flavor",101N71376,4901005155367,0,13290Daum
PDC CELDIE MARINE CITRUS FACE WASH,BU02P03676,4961989204758,0,13290Daum
popping candy(peach),FD22G01054,FD22G01054,0,13290Daum
Baijia Instant Noodles-Pickled Cabbage Flavor 5-Pack,FD03W00103X5,6932760618079,0,13290Daum
Barrier repair mask HAa hyaluronic acid blue,BU11J01758,4902806437980,0,13290Daum
Dr.Morita Q10 Royal Jelly Essence Facial Mask,BU15M02009,4715872641546,0,13290Daum
Popping Candy - Blueberry,FD28S01175,4895138304610,0,13290Daum
Sangaria ramune Strawberry 6.76oz,FD05J00541,733815003675,0,13290Daum
Crown Poteau Cream Biscuit (L),101N67215,8801111917391,0,13290Daum
"Gatsby Moving Rubber Air Rise Hair Wax, 80G/2.8Oz",BU02P01137,45131660,0,13290Daum
Dr.Morita Moisturizing Hyaluronic Acid Essence Facial Mask,BU15M01982,4712688935852,0,13290Daum
Sanritsu Couque Dasses Chocolate Biscuit,FD02T00015,4901830351804,0,13290Daum
Kasugai Ramune Gummy Candy,FD05J00252,4901326040250,0,13290Daum
Hapi Botan Rice Candy,FD05J00195,011152102429,0,13290Daum
I Mel Puff Custard Pudding Family Pack,FD03W00079,4710126025738,0,13290Daum
Dr.Morita Moisturizing Hyaluronic Acid Essence Facial Mask,BU15M01987,4715872641522,0,13290Daum
Want Want Chocolate Wafer Roll Milk 60g,FD25M01116,6921482336064,0,13290Daum
Imuraya Sweets Castilla Original,101N71283,074410712839,0,13290Daum
SHISEIDO FT SUPER MILD SHAMPOO GREEN REFILL,BU02P03905,4901872895885,0,13290Daum
CHAOZHOULANG Fish Ball Pickle Flavor 60g,FD19S00658,6930865300219,0,13290Daum
Ve Wong Instant Oriental Noodle Soup-Chinese Herb Flavor(Pack of 4),FD03W00112,4710008293866,0,13290Daum
Coreana Orthia Perfect Collagen 28 Days Intensive Ampoule Aqua Mask 10pcs,BU05K02313,8804014200324,0,13290Daum
[Laneige] Two Tone Lip Bar 2g 03,BU05K04570,0,0,13290Daum
Miibox 100% raw unrefined organic shea butter-African grade A ivory,BU00M01580,799441252160,0,13290Daum
Japan Kiss me heroine Make lengh mascara,BU02P01496,4901433039383,0,13290Daum
EbayTest,test02,8801111713337,0,13290Daum
Koloko Pea Crackers-Basil Flavor,FD22G00754,4710022001812,0,13290Daum
Glico Giant Pocky Chocolate covered Biscuit Sticks (pack of 5),101N71377,4901005560154,0,13290Daum
Want Want Shelly Senbei Rice Crackers Small,FD04S00174,4710144005101,0,13290Daum
Shirakiku Saki Ika (Spicy Shredded Squid) - 2oz,101N75116,074410751166,0,13290Daum
Taiwan DR. JOU (MORITA) MOISTURIZING  ESSENCE FACIAL MASK (4 SHEETS)(4count ),BU22B05592,4712688936477,0,13290Daum
Orion Q Di,FD19S00963,6920907801323,0,13290Daum
DIAMOND V SLIMMING SERIES V FIT MASK,BU15M01890,8809052590888,0,13290Daum
Dr.Morita Repairing Collagen Essence Facial Black Mask,BU15M01977,4712688935838,0,13290Daum
Popping Candy - Green Apple,FD28S01170,4895138304429,0,13290Daum
Huang Fei Hong Spicy Cripy Peanut - 110g/3.88oz - 30 Packs,FD06E00300X30,6952784301061,0,13290Daum
HSUFUCHI Egg Flavor Soft Flour Cake 469g,FD19S00699,6914782207165,0,13290Daum
[dis] Miss Hana Smoky Eyeliner (Deep Black),BU22B05532,4718590211541,0,13290Daum
Meiji Chocolate Milk,101N64386,074410643867,0,13290Daum
Baijia Instant Cup Noodles-Artificial Black Bone Chicken Flavor,FD03W00105,6932760640018,0,13290Daum
[dis] MISS HANA Novadiva 6-colors Eye Shadow Palette #PK-01,BU22B05538,4718590212364,0,13290Daum
[dis] Miss Hana - Smoky Eye Eyeliner (#12 Choco Brown) 0.35g,BU22B05533,4718590211558,0,13290Daum
3 CONCEPT EYES DOT EYE SHADOW PALETTE #Saddle,BU05K01812,8809437391468,0,13290Daum
Popping Candy - Lychee,FD28S01174,4895138304351,0,13290Daum
Ve Wong Instant Oriental Noodle Soup-Artificial Hot Peppered Beef Flavor,FD03W00114,4710008293873,0,13290Daum
LUCKY TRENDY take off Once moist foot mask (1 times),BU02P02022,4537715991676,0,13290Daum
Popping Candy - Peach,FD28S01172,4895138304825,0,13290Daum
[dis] MISS HANA Novadiva 6-colors Eye Shadow Palette #GR-01,BU22B05539,4718590212371,0,13290Daum
SNP Black Pearl Renew Black Ampoule Mask 10pcs,BU05K02942,8809237828027,0,13290Daum
Kasugai 3 Kinds Of Fruits Gummy Candy,FD05J00255,4901326041288,0,13290Daum
test,test,barcode,0,13290Daum
Shirakiku Prepared Shredded (Squid Dried Squid Plain Flavor) 8 oz,101N75119,074410751197,0,13290Daum
Kasugai Milk Non Sugar Hard Candy,FD05J00247,4901326034839,0,13290Daum
Hyakkei Shoga Senbei Ginger Thin Cookies,FD05J00214,4902156014039,0,13290Daum
SHIROSASA,AL05J00027,086724013045,0,13290Daum
Sapporo Ichiban Instant Bag Shio Ramen Noodles Salt Flavor-5 Pack,101N40041,076186000585,0,13290Daum
KRACIE Rose Gum 6 Pieces,FD21W00917,49431766,0,13290Daum
AQUAMOIST JUNMITSU MOISTURE CREAM,BU02P01777,4901727219019,0,13290Daum
Karno-Nonsugar Coffee Sakan Hard Candy 2.72 Oz,FD02T00306,4901351014752,0,13290Daum
ZOJIRUSHI ZOJIRUSHI GOURMET HANDY POT BRUSHED (1.0L) STAINLESS,BU02P04022,4974305701350,0,13290Daum
